{
  "id": "libri-page",
  "slug": "libri",
  "meta": {
    "title": "Libri",
    "description": "Catalogo libri dimostrativo alimentato da COP collections."
  },
  "sections": [
    {
      "id": "books-list-1",
      "type": "books-list",
      "data": {
        "anchorId": "catalogo-libri",
        "eyebrow": "Collection demo",
        "title": "Libri",
        "description": "Una pagina collection con 30 titoli, paginazione lato componente e link alle schede dinamiche.",
        "items": {
          "$ref": "../collections/libri/libri.json"
        },
        "pageSize": 10
      }
    }
  ],
  "global-header": false
}
