{
  "id": "form-page",
  "slug": "form",
  "meta": {
    "title": "Home",
    "description": "OlonJS tenant alpha — form smoke test"
  },
  "sections": [
    {
      "id": "form-demo-1",
      "type": "form-demo",
      "data": {
        "anchorId": "form-demo",
        "title": "Contattaci",
        "description": "Compila il modulo e ti risponderemo al più presto.",
        "recipientEmail": "test@olonjs.io",
        "submitLabel": "Invia",
        "successMessage": "Richiesta inviata con successo.",
        "icon": "mail"
      }
    }
  ],
  "global-header": false
}